[
  {
    "url": "https://github.com/phac-nml/iridanextexample",
    "name": "phac-nml/iridanextexample",
    "description": "IRIDA Next Example Pipeline",
    "versions": [
      {
        "name": "1.0.2",
        "automatable": true
      },
      {
        "name": "1.0.1",
        "executable": true
      },
      {
        "name": "1.0.0",
        "executable": false
      }
    ]
  }
]
